{
  "schemaVersion": 1,
  "baseTick": 4294967294,
  "profiles": [
    {
      "id": "treadmill",
      "kind": 0,
      "origin": "synthetic-contract-ref",
      "maxAge": 5,
      "format": {
        "resistance": 0,
        "pace": 0
      }
    },
    {
      "id": "cross",
      "kind": 1,
      "origin": "synthetic-contract-ref",
      "maxAge": 5,
      "format": {
        "resistance": 0,
        "pace": 0
      }
    },
    {
      "id": "step",
      "kind": 2,
      "origin": "synthetic-contract-ref",
      "maxAge": 5,
      "format": {
        "resistance": 0,
        "pace": 0
      }
    },
    {
      "id": "stair",
      "kind": 3,
      "origin": "synthetic-contract-ref",
      "maxAge": 5,
      "format": {
        "resistance": 0,
        "pace": 0
      }
    },
    {
      "id": "rower",
      "kind": 4,
      "origin": "synthetic-contract-ref",
      "maxAge": 5,
      "format": {
        "resistance": 0,
        "pace": 0
      }
    },
    {
      "id": "bike",
      "kind": 5,
      "origin": "synthetic-contract-ref",
      "maxAge": 5,
      "format": {
        "resistance": 0,
        "pace": 0
      }
    },
    {
      "id": "bike-signed",
      "kind": 5,
      "origin": "synthetic-contract-ref",
      "maxAge": 5,
      "format": { "resistance": 1, "pace": 0 }
    },
    {
      "id": "cross-signed",
      "kind": 1,
      "origin": "synthetic-contract-ref",
      "maxAge": 5,
      "format": { "resistance": 1, "pace": 0 }
    },
    {
      "id": "rower-signed",
      "kind": 4,
      "origin": "synthetic-contract-ref",
      "maxAge": 5,
      "format": { "resistance": 1, "pace": 0 }
    },
    {
      "id": "tread-legacy",
      "kind": 0,
      "origin": "synthetic-contract-ref",
      "maxAge": 5,
      "format": { "resistance": 0, "pace": 1 }
    }
  ],
  "scenarios": [
    {
      "id": "minimal-treadmill",
      "profile": "treadmill",
      "generation": 7,
      "steps": [
        {
          "at": 0,
          "type": "feed",
          "generation": 7,
          "bytes": [0, 0, 210, 4],
          "expected": {
            "status": "complete",
            "raw": {
              "kind": 0,
              "flags": 0,
              "present": 1,
              "unavailable": 0,
              "values": [
                1234, 0, 0, 0, 0, 0, 0, 0, 0, 0, 0, 0, 0, 0, 0, 0, 0, 0, 0, 0, 0, 0, 0, 0, 0, 0, 0,
                0, 0, 0
              ],
              "moreData": 0,
              "backward": 0,
              "truncated": 0,
              "trailingBytes": 0,
              "reservedFlags": 0,
              "bytesRead": 4
            }
          }
        }
      ]
    },
    {
      "id": "minimal-cross",
      "profile": "cross",
      "generation": 7,
      "steps": [
        {
          "at": 0,
          "type": "feed",
          "generation": 7,
          "bytes": [0, 0, 0, 210, 4],
          "expected": {
            "status": "complete",
            "raw": {
              "kind": 1,
              "flags": 0,
              "present": 1,
              "unavailable": 0,
              "values": [
                1234, 0, 0, 0, 0, 0, 0, 0, 0, 0, 0, 0, 0, 0, 0, 0, 0, 0, 0, 0, 0, 0, 0, 0, 0, 0, 0,
                0, 0, 0
              ],
              "moreData": 0,
              "backward": 0,
              "truncated": 0,
              "trailingBytes": 0,
              "reservedFlags": 0,
              "bytesRead": 5
            }
          }
        }
      ]
    },
    {
      "id": "minimal-step",
      "profile": "step",
      "generation": 7,
      "steps": [
        {
          "at": 0,
          "type": "feed",
          "generation": 7,
          "bytes": [0, 0, 12, 0, 34, 0],
          "expected": {
            "status": "complete",
            "raw": {
              "kind": 2,
              "flags": 0,
              "present": 25165824,
              "unavailable": 0,
              "values": [
                0, 0, 0, 0, 0, 0, 0, 0, 0, 0, 0, 0, 0, 0, 0, 0, 0, 0, 0, 0, 0, 0, 0, 12, 34, 0, 0,
                0, 0, 0
              ],
              "moreData": 0,
              "backward": 0,
              "truncated": 0,
              "trailingBytes": 0,
              "reservedFlags": 0,
              "bytesRead": 6
            }
          }
        }
      ]
    },
    {
      "id": "minimal-stair",
      "profile": "stair",
      "generation": 7,
      "steps": [
        {
          "at": 0,
          "type": "feed",
          "generation": 7,
          "bytes": [0, 0, 12, 0],
          "expected": {
            "status": "complete",
            "raw": {
              "kind": 3,
              "flags": 0,
              "present": 8388608,
              "unavailable": 0,
              "values": [
                0, 0, 0, 0, 0, 0, 0, 0, 0, 0, 0, 0, 0, 0, 0, 0, 0, 0, 0, 0, 0, 0, 0, 12, 0, 0, 0, 0,
                0, 0
              ],
              "moreData": 0,
              "backward": 0,
              "truncated": 0,
              "trailingBytes": 0,
              "reservedFlags": 0,
              "bytesRead": 4
            }
          }
        }
      ]
    },
    {
      "id": "minimal-rower",
      "profile": "rower",
      "generation": 7,
      "steps": [
        {
          "at": 0,
          "type": "feed",
          "generation": 7,
          "bytes": [0, 0, 48, 200, 0],
          "expected": {
            "status": "complete",
            "raw": {
              "kind": 4,
              "flags": 0,
              "present": 100663296,
              "unavailable": 0,
              "values": [
                0, 0, 0, 0, 0, 0, 0, 0, 0, 0, 0, 0, 0, 0, 0, 0, 0, 0, 0, 0, 0, 0, 0, 0, 0, 48, 200,
                0, 0, 0
              ],
              "moreData": 0,
              "backward": 0,
              "truncated": 0,
              "trailingBytes": 0,
              "reservedFlags": 0,
              "bytesRead": 5
            }
          }
        }
      ]
    },
    {
      "id": "minimal-bike",
      "profile": "bike",
      "generation": 7,
      "steps": [
        {
          "at": 0,
          "type": "feed",
          "generation": 7,
          "bytes": [0, 0, 210, 4],
          "expected": {
            "status": "complete",
            "raw": {
              "kind": 5,
              "flags": 0,
              "present": 1,
              "unavailable": 0,
              "values": [
                1234, 0, 0, 0, 0, 0, 0, 0, 0, 0, 0, 0, 0, 0, 0, 0, 0, 0, 0, 0, 0, 0, 0, 0, 0, 0, 0,
                0, 0, 0
              ],
              "moreData": 0,
              "backward": 0,
              "truncated": 0,
              "trailingBytes": 0,
              "reservedFlags": 0,
              "bytesRead": 4
            }
          }
        }
      ]
    },
    {
      "id": "bike-split",
      "profile": "bike",
      "generation": 7,
      "steps": [
        {
          "at": 0,
          "type": "feed",
          "generation": 7,
          "bytes": [3, 0, 46, 22],
          "expected": {
            "status": "pending"
          }
        },
        {
          "at": 2,
          "type": "feed",
          "generation": 7,
          "bytes": [0, 0, 211, 4],
          "expected": {
            "status": "complete",
            "raw": {
              "kind": 5,
              "flags": 2,
              "present": 3,
              "unavailable": 0,
              "values": [
                1235, 5678, 0, 0, 0, 0, 0, 0, 0, 0, 0, 0, 0, 0, 0, 0, 0, 0, 0, 0, 0, 0, 0, 0, 0, 0,
                0, 0, 0, 0
              ],
              "moreData": 0,
              "backward": 0,
              "truncated": 0,
              "trailingBytes": 0,
              "reservedFlags": 0,
              "bytesRead": 0
            }
          }
        }
      ]
    },
    {
      "id": "same-tick-order",
      "profile": "bike",
      "generation": 7,
      "steps": [
        {
          "at": 0,
          "type": "feed",
          "generation": 7,
          "bytes": [3, 0, 46, 22],
          "expected": {
            "status": "pending"
          }
        },
        {
          "at": 0,
          "type": "feed",
          "generation": 7,
          "bytes": [0, 0, 211, 4],
          "expected": {
            "status": "complete",
            "raw": {
              "kind": 5,
              "flags": 2,
              "present": 3,
              "unavailable": 0,
              "values": [
                1235, 5678, 0, 0, 0, 0, 0, 0, 0, 0, 0, 0, 0, 0, 0, 0, 0, 0, 0, 0, 0, 0, 0, 0, 0, 0,
                0, 0, 0, 0
              ],
              "moreData": 0,
              "backward": 0,
              "truncated": 0,
              "trailingBytes": 0,
              "reservedFlags": 0,
              "bytesRead": 0
            }
          }
        }
      ]
    },
    {
      "id": "expiry-boundary",
      "profile": "bike",
      "generation": 7,
      "steps": [
        {
          "at": 0,
          "type": "feed",
          "generation": 7,
          "bytes": [3, 0, 46, 22],
          "expected": {
            "status": "pending"
          }
        },
        {
          "at": 5,
          "type": "feed",
          "generation": 7,
          "bytes": [0, 0, 211, 4],
          "expected": {
            "status": "expired"
          }
        }
      ]
    },
    {
      "id": "expiry-within",
      "profile": "bike",
      "generation": 7,
      "steps": [
        {
          "at": 0,
          "type": "feed",
          "generation": 7,
          "bytes": [3, 0, 46, 22],
          "expected": {
            "status": "pending"
          }
        },
        {
          "at": 4,
          "type": "feed",
          "generation": 7,
          "bytes": [0, 0, 211, 4],
          "expected": {
            "status": "complete",
            "raw": {
              "kind": 5,
              "flags": 2,
              "present": 3,
              "unavailable": 0,
              "values": [
                1235, 5678, 0, 0, 0, 0, 0, 0, 0, 0, 0, 0, 0, 0, 0, 0, 0, 0, 0, 0, 0, 0, 0, 0, 0, 0,